{
  "protocolVersion": "terminal-operations.v2",
  "datasetId": "replace-with-authorized-shanghai-dataset-id",
  "portId": "CNSHA",
  "sceneProfileId": "shanghai-international-port",
  "source": "operator-authorized SIPG/TOS/VTS export",
  "sourceUrl": "",
  "license": "operator-confidential; redistribution prohibited unless explicitly authorized",
  "evidenceLevel": "synthetic-contract-example",
  "timezone": "Asia/Shanghai",
  "samplingInterval": "15 minutes",
  "dataPath": "/absolute/path/to/authorized/shanghai_terminal_operations.csv",
  "availableFields": [
    "port_id",
    "terminal_id",
    "timestamp",
    "arrivals",
    "gross_tonnage",
    "effective_service_capacity",
    "queue_vessels",
    "average_waiting_hours",
    "berth_utilization_percent",
    "yard_occupancy_percent",
    "quay_crane_moves_per_hour",
    "truck_turn_time_minutes",
    "rail_transfer_teu",
    "water_transfer_teu",
    "planned_eta",
    "actual_eta",
    "channel_available",
    "tide_window_open",
    "pilot_available_count",
    "tug_available_count",
    "wind_speed_ms",
    "wave_height_m",
    "visibility_km",
    "current_speed_knots",
    "safety_incidents",
    "hazmat_restriction_active",
    "shore_power_available",
    "shore_power_used",
    "fuel_consumption_tons",
    "carbon_emissions_tons",
    "fuel_price",
    "carbon_price",
    "transfer_capacity",
    "transfer_cost",
    "vessel_class",
    "queue_entry_time",
    "service_start_time"
  ],
  "fieldMappings": {
    "port_id": "port_code",
    "terminal_id": "terminal_code",
    "timestamp": "interval_start",
    "arrivals": "vessel_arrivals",
    "gross_tonnage": "gross_tonnage",
    "effective_service_capacity": "effective_service_capacity",
    "queue_vessels": "queue_vessels",
    "average_waiting_hours": "average_waiting_hours",
    "berth_utilization_percent": "berth_utilization_percent",
    "yard_occupancy_percent": "yard_occupancy_percent",
    "quay_crane_moves_per_hour": "quay_crane_moves_per_hour",
    "truck_turn_time_minutes": "truck_turn_time_minutes",
    "rail_transfer_teu": "rail_transfer_teu",
    "water_transfer_teu": "water_transfer_teu",
    "planned_eta": "planned_eta",
    "actual_eta": "actual_eta",
    "channel_available": "channel_available",
    "tide_window_open": "tide_window_open",
    "pilot_available_count": "pilot_available_count",
    "tug_available_count": "tug_available_count",
    "wind_speed_ms": "wind_speed_ms",
    "wave_height_m": "wave_height_m",
    "visibility_km": "visibility_km",
    "current_speed_knots": "current_speed_knots",
    "safety_incidents": "safety_incidents",
    "hazmat_restriction_active": "hazmat_restriction_active",
    "shore_power_available": "shore_power_available",
    "shore_power_used": "shore_power_used",
    "fuel_consumption_tons": "fuel_consumption_tons",
    "carbon_emissions_tons": "carbon_emissions_tons",
    "fuel_price": "fuel_price",
    "carbon_price": "carbon_price",
    "transfer_capacity": "transfer_capacity",
    "transfer_cost": "transfer_cost",
    "vessel_class": "vessel_class",
    "queue_entry_time": "queue_entry_time",
    "service_start_time": "service_start_time"
  },
  "notes": [
    "This file is a field-mapping template, not Shanghai operational data.",
    "Set evidenceLevel to operator-authorized only after the source, units, quality codes and redistribution boundary are reviewed."
  ]
}
